{"schema_version":"1.0","source_id":"66666666-6666-4666-8666-666666666666","metric_id":"runtime.reachable","definition_revision":"mac-ollama-1","observed_ms":1789473600000,"aligned_ms":1789473600085,"uncertainty_ms":4,"quality":"runtime_reported","value":false,"missing_reason":null,"provenance":{"source":"runtime_api","method_revision":"ollama-bounded-read-v1","verification":"synthetic_fixture"}}
